idmensaje, idusuario,followers,mensaje
1,1,8996,Morbi non quam nec dui luctus rutrum. Nulla tellus. 
2,1,94946,Nam congue, risus semper porta volutpat, quam pede lobortis ligula
3,2,3450,Nullam orci pede, venenatis no
4,3,46580,Curabitur convallis. Duis consequat dui nec nisi volutpat eleifend. 
5,3,51,Cum sociis natoque penatibus et magnis dis parturient montes
6,4,3161,Aliquam augue quam, sollicitudin vitae, consectetuer eget
7,5,8,Vestibulum ac est lacinia nisi venenatis tristique. 
9,6,80,In est risus
10,7,94582,Aenean lectus. Pellentesque eget nunc. 
11,8,327,Duis mattis egestas metus. Aenean fermentum.  
12,8,2947,Proin risus. Praesent lectus. 
13,9,1,Nulla nisl. Nunc nisl. Duis bibendum, felis sed interdum venenatis
14,10,46,Duis aliquam convallis nunc. Proin at turpis a pede posuere nonummy. 
15,10,1552,Nullam porttitor lacus at turpis. Donec posuere metus vitae ipsum. 
16,11,25,orem ipsum dolor sit amet, consectetuer adipiscing elit. 
17,12,7428,Nulla tempus. Vivamus in felis eu sapien cursus vestibulum. 
18,12,334,In eleifend quam a odio. In hac habitasse platea dictumst. 
19,13,238,Nullam orci pede, venenatis non, sodales sed, tincidunt eu, felis. 
20,14,4,Donec posuere metus vitae ipsum. Aliquam non mauris. Morbi non lectus. 
22,15,1564,Pellentesque eget nunc. Donec quis orci eget orci vehicula condimentum. 
23,16,321,Proin eu mi. Nulla ac enim. In tempor, turpis nec euismod scelerisque
24,17,0,Praesent lectus. Vestibulum quam sapien, varius ut 
25,17,25208,In blandit ultrices enim. Lorem ipsum dolor sit 
26,18,029,Nullam 
27,1,299,Morbi 
28,19,7,Fusce congue, diam id ornare imperdiet, 
29,20,0,Quisque id justo sit amet sapien dignissim vestibulum. 
30,1,8,Donec dapibus. Duis at velit eu est congue elementum. 